{
  "schemaVersion": "1.0",
  "manifestType": "component",
  "catalogVersion": "0.4.0",
  "id": "tip",
  "version": "1.0.0",
  "displayName": "实用技巧",
  "description": "把经验浓缩成短小、可复制的操作建议。",
  "status": "active",
  "category": "emphasis",
  "legacyIds": [],
  "blockKind": "container",
  "slots": [
    {
      "id": "body",
      "kind": "richText",
      "required": true,
      "maxLength": 4000
    }
  ],
  "semantics": {
    "role": "note",
    "ariaLabel": "实用技巧",
    "markdownFallback": "callout"
  },
  "constraints": {
    "minItems": 1,
    "maxItems": 1,
    "allowNestedComponents": false,
    "spanLeaf": true,
    "allowScripts": false,
    "allowExternalStyles": false
  },
  "templateMarkdown": "> [!note] 实用技巧\n> **推荐做法：** [填写基于本地知识库的内容]\n> \n> **有效原因：** [填写基于本地知识库的内容]\n> \n> **适用边界：** [填写基于本地知识库的内容]\n>\n> **来源：** [[替换为实际笔记标题]]",
  "renderers": {
    "markdown": "creation.component.tip.markdown.v1",
    "html": "creation.component.tip.html.v1",
    "wechatRichText": "creation.component.tip.wechat.v1"
  },
  "compatibility": {
    "targets": [
      "markdown",
      "html",
      "wechatRichText"
    ],
    "minRuntimeVersion": "0.1.2"
  },
  "source": {
    "policy": "yunspire_first_party",
    "authoredBy": "Yunspire",
    "repository": "https://github.com/Leo-sail/yunspire",
    "upstreamCodeCopied": false,
    "researchBoundary": "This component is an original Yunspire project asset. External repositories informed capability research only; no upstream code, prompt, template, wording, or visual asset is included."
  },
  "license": {
    "scope": "yunspire_first_party_project_asset",
    "notice": "Original Yunspire component manifest and Markdown block; use is governed by the repository LICENSE.",
    "thirdPartyAssets": []
  }
}
