{
  "schemaVersion": "1.0",
  "manifestType": "component",
  "catalogVersion": "0.4.0",
  "id": "video-card",
  "version": "1.0.0",
  "displayName": "视频卡",
  "description": "将视频、关键时间点和文字摘要组合成可回看的内容单元。",
  "status": "active",
  "category": "media",
  "legacyIds": [],
  "blockKind": "media",
  "slots": [
    {
      "id": "body",
      "kind": "image",
      "required": true,
      "maxLength": 4000
    }
  ],
  "semantics": {
    "role": "figure",
    "ariaLabel": "视频卡",
    "markdownFallback": "figure"
  },
  "constraints": {
    "minItems": 1,
    "maxItems": 1,
    "allowNestedComponents": false,
    "spanLeaf": true,
    "allowScripts": false,
    "allowExternalStyles": false
  },
  "templateMarkdown": "### 视频卡\n\n![替换为实际图片](assets/replace-me.png)\n\n**视频摘要：** [填写说明]\n\n**关键时间点：** [填写说明]\n\n**授权来源：** [填写说明]\n\n**来源与授权：** [[替换为实际笔记标题]]",
  "renderers": {
    "markdown": "creation.component.video-card.markdown.v1",
    "html": "creation.component.video-card.html.v1",
    "wechatRichText": "creation.component.video-card.wechat.v1"
  },
  "compatibility": {
    "targets": [
      "markdown",
      "html",
      "wechatRichText"
    ],
    "minRuntimeVersion": "0.1.2"
  },
  "source": {
    "policy": "yunspire_first_party",
    "authoredBy": "Yunspire",
    "repository": "https://github.com/Leo-sail/yunspire",
    "upstreamCodeCopied": false,
    "researchBoundary": "This component is an original Yunspire project asset. External repositories informed capability research only; no upstream code, prompt, template, wording, or visual asset is included."
  },
  "license": {
    "scope": "yunspire_first_party_project_asset",
    "notice": "Original Yunspire component manifest and Markdown block; use is governed by the repository LICENSE.",
    "thirdPartyAssets": []
  }
}
