{
  "schemaVersion": "1.0",
  "manifestType": "component",
  "catalogVersion": "0.4.0",
  "id": "divider",
  "version": "1.0.0",
  "displayName": "分隔组件",
  "description": "在章节或叙事节奏之间插入语义分隔。",
  "status": "active",
  "category": "navigation",
  "legacyIds": [],
  "blockKind": "divider",
  "slots": [],
  "semantics": {
    "role": "separator",
    "ariaLabel": "分隔组件",
    "markdownFallback": "thematicBreak"
  },
  "constraints": {
    "minItems": 0,
    "maxItems": 1,
    "allowNestedComponents": false,
    "spanLeaf": false,
    "allowScripts": false,
    "allowExternalStyles": false
  },
  "templateMarkdown": "---",
  "renderers": {
    "markdown": "creation.component.divider.markdown.v1",
    "html": "creation.component.divider.html.v1",
    "wechatRichText": "creation.component.divider.wechat.v1"
  },
  "compatibility": {
    "targets": [
      "markdown",
      "html",
      "wechatRichText"
    ],
    "minRuntimeVersion": "0.1.2"
  },
  "source": {
    "policy": "yunspire_first_party",
    "authoredBy": "Yunspire",
    "repository": "https://github.com/Leo-sail/yunspire",
    "upstreamCodeCopied": false,
    "researchBoundary": "This component is an original Yunspire project asset. External repositories informed capability research only; no upstream code, prompt, template, wording, or visual asset is included."
  },
  "license": {
    "scope": "yunspire_first_party_project_asset",
    "notice": "Original Yunspire component manifest and Markdown block; use is governed by the repository LICENSE.",
    "thirdPartyAssets": []
  }
}
