{
  "schemaVersion": "1.0",
  "manifestType": "component",
  "catalogVersion": "0.4.0",
  "id": "timeline",
  "version": "1.0.0",
  "displayName": "时间线",
  "description": "按时间顺序呈现事件、版本或研究进展。",
  "status": "active",
  "category": "sequence",
  "legacyIds": [],
  "blockKind": "collection",
  "slots": [
    {
      "id": "items",
      "kind": "list",
      "required": true,
      "maxLength": 10000
    }
  ],
  "semantics": {
    "role": "timeline",
    "ariaLabel": "时间线",
    "markdownFallback": "list"
  },
  "constraints": {
    "minItems": 1,
    "maxItems": 30,
    "allowNestedComponents": false,
    "spanLeaf": true,
    "allowScripts": false,
    "allowExternalStyles": false
  },
  "templateMarkdown": "### 时间线\n\n- [ ] **起点事件：** [填写基于知识库的内容]\n- [ ] **关键转折：** [填写基于知识库的内容]\n- [ ] **当前状态：** [填写基于知识库的内容]\n\n**来源：** [[替换为实际笔记标题]]",
  "renderers": {
    "markdown": "creation.component.timeline.markdown.v1",
    "html": "creation.component.timeline.html.v1",
    "wechatRichText": "creation.component.timeline.wechat.v1"
  },
  "compatibility": {
    "targets": [
      "markdown",
      "html",
      "wechatRichText"
    ],
    "minRuntimeVersion": "0.1.2"
  },
  "source": {
    "policy": "yunspire_first_party",
    "authoredBy": "Yunspire",
    "repository": "https://github.com/Leo-sail/yunspire",
    "upstreamCodeCopied": false,
    "researchBoundary": "This component is an original Yunspire project asset. External repositories informed capability research only; no upstream code, prompt, template, wording, or visual asset is included."
  },
  "license": {
    "scope": "yunspire_first_party_project_asset",
    "notice": "Original Yunspire component manifest and Markdown block; use is governed by the repository LICENSE.",
    "thirdPartyAssets": []
  }
}
