{
  "schemaVersion": "1.0",
  "manifestType": "component",
  "catalogVersion": "0.4.0",
  "id": "quote",
  "version": "1.0.0",
  "displayName": "引用组件",
  "description": "突出有出处的原话或需要读者停留的关键句。",
  "status": "active",
  "category": "emphasis",
  "legacyIds": [],
  "blockKind": "container",
  "slots": [
    {
      "id": "body",
      "kind": "richText",
      "required": true,
      "maxLength": 4000
    }
  ],
  "semantics": {
    "role": "blockquote",
    "ariaLabel": "引用组件",
    "markdownFallback": "blockquote"
  },
  "constraints": {
    "minItems": 1,
    "maxItems": 1,
    "allowNestedComponents": false,
    "spanLeaf": true,
    "allowScripts": false,
    "allowExternalStyles": false
  },
  "templateMarkdown": "> “在这里填写引用原文。”\n>\n> — 作者或来源\n\n**引用位置：** [补充可核验信息]",
  "renderers": {
    "markdown": "creation.component.quote.markdown.v1",
    "html": "creation.component.quote.html.v1",
    "wechatRichText": "creation.component.quote.wechat.v1"
  },
  "compatibility": {
    "targets": [
      "markdown",
      "html",
      "wechatRichText"
    ],
    "minRuntimeVersion": "0.1.2"
  },
  "source": {
    "policy": "yunspire_first_party",
    "authoredBy": "Yunspire",
    "repository": "https://github.com/Leo-sail/yunspire",
    "upstreamCodeCopied": false,
    "researchBoundary": "This component is an original Yunspire project asset. External repositories informed capability research only; no upstream code, prompt, template, wording, or visual asset is included."
  },
  "license": {
    "scope": "yunspire_first_party_project_asset",
    "notice": "Original Yunspire component manifest and Markdown block; use is governed by the repository LICENSE.",
    "thirdPartyAssets": []
  }
}
