{
  "schemaVersion": "1.0",
  "manifestType": "component",
  "catalogVersion": "0.4.0",
  "id": "case-study",
  "version": "1.0.0",
  "displayName": "案例组件",
  "description": "用背景、动作、结果和复盘完整讲清一个案例。",
  "status": "active",
  "category": "information",
  "legacyIds": [],
  "blockKind": "container",
  "slots": [
    {
      "id": "body",
      "kind": "richText",
      "required": true,
      "maxLength": 4000
    }
  ],
  "semantics": {
    "role": "figure",
    "ariaLabel": "案例组件",
    "markdownFallback": "paragraphs"
  },
  "constraints": {
    "minItems": 1,
    "maxItems": 1,
    "allowNestedComponents": false,
    "spanLeaf": true,
    "allowScripts": false,
    "allowExternalStyles": false
  },
  "templateMarkdown": "### 案例组件\n\n**背景与目标：** [填写基于本地知识库的内容]\n\n**关键动作：** [填写基于本地知识库的内容]\n\n**结果与复盘：** [填写基于本地知识库的内容]\n\n**来源：** [[替换为实际笔记标题]]",
  "renderers": {
    "markdown": "creation.component.case-study.markdown.v1",
    "html": "creation.component.case-study.html.v1",
    "wechatRichText": "creation.component.case-study.wechat.v1"
  },
  "compatibility": {
    "targets": [
      "markdown",
      "html",
      "wechatRichText"
    ],
    "minRuntimeVersion": "0.1.2"
  },
  "source": {
    "policy": "yunspire_first_party",
    "authoredBy": "Yunspire",
    "repository": "https://github.com/Leo-sail/yunspire",
    "upstreamCodeCopied": false,
    "researchBoundary": "This component is an original Yunspire project asset. External repositories informed capability research only; no upstream code, prompt, template, wording, or visual asset is included."
  },
  "license": {
    "scope": "yunspire_first_party_project_asset",
    "notice": "Original Yunspire component manifest and Markdown block; use is governed by the repository LICENSE.",
    "thirdPartyAssets": []
  }
}
