{
  "schemaVersion": "1.0",
  "manifestType": "component",
  "catalogVersion": "0.4.0",
  "id": "evidence",
  "version": "1.0.0",
  "displayName": "证据卡",
  "description": "把主张、证据、来源和可信度放在同一块，便于复核。",
  "status": "active",
  "category": "information",
  "legacyIds": [],
  "blockKind": "container",
  "slots": [
    {
      "id": "body",
      "kind": "richText",
      "required": true,
      "maxLength": 4000
    }
  ],
  "semantics": {
    "role": "figure",
    "ariaLabel": "证据卡",
    "markdownFallback": "table"
  },
  "constraints": {
    "minItems": 1,
    "maxItems": 1,
    "allowNestedComponents": false,
    "spanLeaf": true,
    "allowScripts": false,
    "allowExternalStyles": false
  },
  "templateMarkdown": "### 证据卡\n\n| 待证主张 | 证据内容 | 可信度限制 |\n| --- | --- | --- |\n| [填写内容] | [填写内容] | [填写内容] |\n\n**来源：** [[替换为实际笔记标题]]",
  "renderers": {
    "markdown": "creation.component.evidence.markdown.v1",
    "html": "creation.component.evidence.html.v1",
    "wechatRichText": "creation.component.evidence.wechat.v1"
  },
  "compatibility": {
    "targets": [
      "markdown",
      "html",
      "wechatRichText"
    ],
    "minRuntimeVersion": "0.1.2"
  },
  "source": {
    "policy": "yunspire_first_party",
    "authoredBy": "Yunspire",
    "repository": "https://github.com/Leo-sail/yunspire",
    "upstreamCodeCopied": false,
    "researchBoundary": "This component is an original Yunspire project asset. External repositories informed capability research only; no upstream code, prompt, template, wording, or visual asset is included."
  },
  "license": {
    "scope": "yunspire_first_party_project_asset",
    "notice": "Original Yunspire component manifest and Markdown block; use is governed by the repository LICENSE.",
    "thirdPartyAssets": []
  }
}
