{
  "schemaVersion": "1.0",
  "manifestType": "component",
  "catalogVersion": "0.4.0",
  "id": "roadmap",
  "version": "1.0.0",
  "displayName": "路线图",
  "description": "把长期方向拆成阶段性目标与可回看的决策节点。",
  "status": "active",
  "category": "sequence",
  "legacyIds": [],
  "blockKind": "collection",
  "slots": [
    {
      "id": "items",
      "kind": "list",
      "required": true,
      "maxLength": 10000
    }
  ],
  "semantics": {
    "role": "timeline",
    "ariaLabel": "路线图",
    "markdownFallback": "list"
  },
  "constraints": {
    "minItems": 1,
    "maxItems": 20,
    "allowNestedComponents": false,
    "spanLeaf": true,
    "allowScripts": false,
    "allowExternalStyles": false
  },
  "templateMarkdown": "### 路线图\n\n- [ ] **近期基础：** [填写基于知识库的内容]\n- [ ] **中期验证：** [填写基于知识库的内容]\n- [ ] **远期扩展：** [填写基于知识库的内容]\n\n**来源：** [[替换为实际笔记标题]]",
  "renderers": {
    "markdown": "creation.component.roadmap.markdown.v1",
    "html": "creation.component.roadmap.html.v1",
    "wechatRichText": "creation.component.roadmap.wechat.v1"
  },
  "compatibility": {
    "targets": [
      "markdown",
      "html",
      "wechatRichText"
    ],
    "minRuntimeVersion": "0.1.2"
  },
  "source": {
    "policy": "yunspire_first_party",
    "authoredBy": "Yunspire",
    "repository": "https://github.com/Leo-sail/yunspire",
    "upstreamCodeCopied": false,
    "researchBoundary": "This component is an original Yunspire project asset. External repositories informed capability research only; no upstream code, prompt, template, wording, or visual asset is included."
  },
  "license": {
    "scope": "yunspire_first_party_project_asset",
    "notice": "Original Yunspire component manifest and Markdown block; use is governed by the repository LICENSE.",
    "thirdPartyAssets": []
  }
}
