{
  "schemaVersion": "1.0",
  "manifestType": "component",
  "catalogVersion": "0.4.0",
  "id": "dialogue",
  "version": "1.0.0",
  "displayName": "对话组件",
  "description": "用成对问答或多轮对话推进解释。",
  "status": "active",
  "category": "conversation",
  "legacyIds": [],
  "blockKind": "collection",
  "slots": [
    {
      "id": "items",
      "kind": "list",
      "required": true,
      "maxLength": 10000
    }
  ],
  "semantics": {
    "role": "dialog",
    "ariaLabel": "对话组件",
    "markdownFallback": "paragraphs"
  },
  "constraints": {
    "minItems": 2,
    "maxItems": 20,
    "allowNestedComponents": false,
    "spanLeaf": true,
    "allowScripts": false,
    "allowExternalStyles": false
  },
  "templateMarkdown": "### 对话组件\n\n**读者问题：** [填写基于本地知识库的内容]\n\n**基于来源的回答：** [填写基于本地知识库的内容]\n\n**需要追问的边界：** [填写基于本地知识库的内容]\n\n**来源：** [[替换为实际笔记标题]]",
  "renderers": {
    "markdown": "creation.component.dialogue.markdown.v1",
    "html": "creation.component.dialogue.html.v1",
    "wechatRichText": "creation.component.dialogue.wechat.v1"
  },
  "compatibility": {
    "targets": [
      "markdown",
      "html",
      "wechatRichText"
    ],
    "minRuntimeVersion": "0.1.2"
  },
  "source": {
    "policy": "yunspire_first_party",
    "authoredBy": "Yunspire",
    "repository": "https://github.com/Leo-sail/yunspire",
    "upstreamCodeCopied": false,
    "researchBoundary": "This component is an original Yunspire project asset. External repositories informed capability research only; no upstream code, prompt, template, wording, or visual asset is included."
  },
  "license": {
    "scope": "yunspire_first_party_project_asset",
    "notice": "Original Yunspire component manifest and Markdown block; use is governed by the repository LICENSE.",
    "thirdPartyAssets": []
  }
}
