{
  "schemaVersion": "1.0",
  "manifestType": "component",
  "catalogVersion": "0.4.0",
  "id": "data-table",
  "version": "1.0.0",
  "displayName": "数据表",
  "description": "用统一口径呈现可排序、可复核的数据表格。",
  "status": "active",
  "category": "information",
  "legacyIds": [],
  "blockKind": "collection",
  "slots": [
    {
      "id": "items",
      "kind": "list",
      "required": true,
      "maxLength": 10000
    }
  ],
  "semantics": {
    "role": "group",
    "ariaLabel": "数据表",
    "markdownFallback": "table"
  },
  "constraints": {
    "minItems": 1,
    "maxItems": 100,
    "allowNestedComponents": false,
    "spanLeaf": true,
    "allowScripts": false,
    "allowExternalStyles": false
  },
  "templateMarkdown": "### 数据表\n\n| 数据项目 | 指标数值 | 口径备注 |\n| --- | --- | --- |\n| [填写内容] | [填写内容] | [填写内容] |\n\n**来源：** [[替换为实际笔记标题]]",
  "renderers": {
    "markdown": "creation.component.data-table.markdown.v1",
    "html": "creation.component.data-table.html.v1",
    "wechatRichText": "creation.component.data-table.wechat.v1"
  },
  "compatibility": {
    "targets": [
      "markdown",
      "html",
      "wechatRichText"
    ],
    "minRuntimeVersion": "0.1.2"
  },
  "source": {
    "policy": "yunspire_first_party",
    "authoredBy": "Yunspire",
    "repository": "https://github.com/Leo-sail/yunspire",
    "upstreamCodeCopied": false,
    "researchBoundary": "This component is an original Yunspire project asset. External repositories informed capability research only; no upstream code, prompt, template, wording, or visual asset is included."
  },
  "license": {
    "scope": "yunspire_first_party_project_asset",
    "notice": "Original Yunspire component manifest and Markdown block; use is governed by the repository LICENSE.",
    "thirdPartyAssets": []
  }
}
