{
  "schemaVersion": "1.0",
  "manifestType": "component",
  "catalogVersion": "0.4.0",
  "id": "next-steps",
  "version": "1.0.0",
  "displayName": "后续动作",
  "description": "把内容结论转换成负责人、时间和验收信号都明确的行动。",
  "status": "active",
  "category": "conversion",
  "legacyIds": [],
  "blockKind": "collection",
  "slots": [
    {
      "id": "items",
      "kind": "list",
      "required": true,
      "maxLength": 10000
    }
  ],
  "semantics": {
    "role": "list",
    "ariaLabel": "后续动作",
    "markdownFallback": "list"
  },
  "constraints": {
    "minItems": 1,
    "maxItems": 20,
    "allowNestedComponents": false,
    "spanLeaf": true,
    "allowScripts": false,
    "allowExternalStyles": false
  },
  "templateMarkdown": "### 后续动作\n\n- [ ] **具体动作：** [填写基于知识库的内容]\n- [ ] **负责人和截止时间：** [填写基于知识库的内容]\n- [ ] **验收结果：** [填写基于知识库的内容]\n\n**来源：** [[替换为实际笔记标题]]",
  "renderers": {
    "markdown": "creation.component.next-steps.markdown.v1",
    "html": "creation.component.next-steps.html.v1",
    "wechatRichText": "creation.component.next-steps.wechat.v1"
  },
  "compatibility": {
    "targets": [
      "markdown",
      "html",
      "wechatRichText"
    ],
    "minRuntimeVersion": "0.1.2"
  },
  "source": {
    "policy": "yunspire_first_party",
    "authoredBy": "Yunspire",
    "repository": "https://github.com/Leo-sail/yunspire",
    "upstreamCodeCopied": false,
    "researchBoundary": "This component is an original Yunspire project asset. External repositories informed capability research only; no upstream code, prompt, template, wording, or visual asset is included."
  },
  "license": {
    "scope": "yunspire_first_party_project_asset",
    "notice": "Original Yunspire component manifest and Markdown block; use is governed by the repository LICENSE.",
    "thirdPartyAssets": []
  }
}
