{
  "schemaVersion": "1.0",
  "manifestType": "component",
  "catalogVersion": "0.4.0",
  "id": "before-after",
  "version": "1.0.0",
  "displayName": "前后对照",
  "description": "用具体细节展示改写、优化或流程变化前后的差异。",
  "status": "active",
  "category": "comparison",
  "legacyIds": [],
  "blockKind": "collection",
  "slots": [
    {
      "id": "items",
      "kind": "list",
      "required": true,
      "maxLength": 10000
    }
  ],
  "semantics": {
    "role": "group",
    "ariaLabel": "前后对照",
    "markdownFallback": "table"
  },
  "constraints": {
    "minItems": 2,
    "maxItems": 2,
    "allowNestedComponents": false,
    "spanLeaf": true,
    "allowScripts": false,
    "allowExternalStyles": false
  },
  "templateMarkdown": "### 前后对照\n\n| 观察维度 | 调整前 | 调整后 |\n| --- | --- | --- |\n| [填写内容] | [填写内容] | [填写内容] |\n\n**来源：** [[替换为实际笔记标题]]",
  "renderers": {
    "markdown": "creation.component.before-after.markdown.v1",
    "html": "creation.component.before-after.html.v1",
    "wechatRichText": "creation.component.before-after.wechat.v1"
  },
  "compatibility": {
    "targets": [
      "markdown",
      "html",
      "wechatRichText"
    ],
    "minRuntimeVersion": "0.1.2"
  },
  "source": {
    "policy": "yunspire_first_party",
    "authoredBy": "Yunspire",
    "repository": "https://github.com/Leo-sail/yunspire",
    "upstreamCodeCopied": false,
    "researchBoundary": "This component is an original Yunspire project asset. External repositories informed capability research only; no upstream code, prompt, template, wording, or visual asset is included."
  },
  "license": {
    "scope": "yunspire_first_party_project_asset",
    "notice": "Original Yunspire component manifest and Markdown block; use is governed by the repository LICENSE.",
    "thirdPartyAssets": []
  }
}
