{
  "schemaVersion": "1.0",
  "manifestType": "component",
  "catalogVersion": "0.4.0",
  "id": "section-summary",
  "version": "1.0.0",
  "displayName": "章节小结",
  "description": "在章节末尾复盘本节结论并自然引向下一节。",
  "status": "active",
  "category": "structure",
  "legacyIds": [],
  "blockKind": "container",
  "slots": [
    {
      "id": "body",
      "kind": "richText",
      "required": true,
      "maxLength": 4000
    }
  ],
  "semantics": {
    "role": "note",
    "ariaLabel": "章节小结",
    "markdownFallback": "callout"
  },
  "constraints": {
    "minItems": 1,
    "maxItems": 1,
    "allowNestedComponents": false,
    "spanLeaf": true,
    "allowScripts": false,
    "allowExternalStyles": false
  },
  "templateMarkdown": "> [!note] 章节小结\n> **已经确认：** [填写基于本地知识库的内容]\n> \n> **仍待核验：** [填写基于本地知识库的内容]\n> \n> **下一节方向：** [填写基于本地知识库的内容]\n>\n> **来源：** [[替换为实际笔记标题]]",
  "renderers": {
    "markdown": "creation.component.section-summary.markdown.v1",
    "html": "creation.component.section-summary.html.v1",
    "wechatRichText": "creation.component.section-summary.wechat.v1"
  },
  "compatibility": {
    "targets": [
      "markdown",
      "html",
      "wechatRichText"
    ],
    "minRuntimeVersion": "0.1.2"
  },
  "source": {
    "policy": "yunspire_first_party",
    "authoredBy": "Yunspire",
    "repository": "https://github.com/Leo-sail/yunspire",
    "upstreamCodeCopied": false,
    "researchBoundary": "This component is an original Yunspire project asset. External repositories informed capability research only; no upstream code, prompt, template, wording, or visual asset is included."
  },
  "license": {
    "scope": "yunspire_first_party_project_asset",
    "notice": "Original Yunspire component manifest and Markdown block; use is governed by the repository LICENSE.",
    "thirdPartyAssets": []
  }
}
